{
  "version": 1,
  "detection_batch_sha256": "d6164a95c617d0f698cd003328cd85d8e5cae4402950b848e2605c52a33c2a6b",
  "left_prediction_sha256": "43f7a0cb4104ad23adf6b224c042551244f64efdd1729e1d4cc28c86f3dae34b",
  "right_prediction_sha256": "b6be66d47eb7d9d1d206a5d0b89f0e6716886d0b25e9d7e8b8005805414c9f01",
  "left_tracker_adapter": "iou_tracker_v1",
  "left_tracker_revision": "greedy_iou_v1",
  "left_tracker_config_sha256": "37053d883864b145e413f7653c71ab35843080b626b1510e313ee01699df9004",
  "left_runtime_id": "python_stdlib",
  "right_tracker_adapter": "synthetic_split_tracker_v1",
  "right_tracker_revision": "split_person_link_v1",
  "right_tracker_config_sha256": "cccccccccccccccccccccccccccccccccccccccccccccccccccccccccccccccc",
  "right_runtime_id": "python_stdlib",
  "assignment_count": 4,
  "left_predicted_track_count": 2,
  "right_predicted_track_count": 3,
  "left_link_count": 2,
  "right_link_count": 1,
  "shared_link_count": 1,
  "left_only_link_count": 1,
  "right_only_link_count": 0,
  "continuous_disagreement_count": 1,
  "recovery_disagreement_count": 0,
  "disagreement_frame_count": 2,
  "disagreement_frame_ids": [
    "frame_0001",
    "frame_0002"
  ],
  "disagreement_frames_truncated": false,
  "human_ground_truth_used": false,
  "accuracy_evaluated": false,
  "better_adapter_selected": false,
  "subject_identity_inference": false,
  "source_media_included": false,
  "paths_disclosed": false
}
