{
  "version": 1,
  "detection_batch_sha256": "d6164a95c617d0f698cd003328cd85d8e5cae4402950b848e2605c52a33c2a6b",
  "left_prediction_sha256": "43f7a0cb4104ad23adf6b224c042551244f64efdd1729e1d4cc28c86f3dae34b",
  "right_prediction_sha256": "a5f80430798f59f67339b64d1f9f1b81cf408f5c6012fbf7e8cfb52539c013e8",
  "left_tracker_adapter": "iou_tracker_v1",
  "left_tracker_revision": "greedy_iou_v1",
  "left_tracker_config_sha256": "37053d883864b145e413f7653c71ab35843080b626b1510e313ee01699df9004",
  "left_runtime_id": "python_stdlib",
  "right_tracker_adapter": "motion_two_stage_tracker_v1",
  "right_tracker_revision": "constant_velocity_global_match_v2",
  "right_tracker_config_sha256": "fb7b008dcbc405647d645029635afccef39d802fa703c0be542c7d40cfec995c",
  "right_runtime_id": "python_stdlib",
  "assignment_count": 4,
  "left_predicted_track_count": 2,
  "right_predicted_track_count": 2,
  "left_link_count": 2,
  "right_link_count": 2,
  "shared_link_count": 2,
  "left_only_link_count": 0,
  "right_only_link_count": 0,
  "continuous_disagreement_count": 0,
  "recovery_disagreement_count": 0,
  "disagreement_frame_count": 0,
  "disagreement_frame_ids": [],
  "disagreement_frames_truncated": false,
  "human_ground_truth_used": false,
  "accuracy_evaluated": false,
  "better_adapter_selected": false,
  "subject_identity_inference": false,
  "source_media_included": false,
  "paths_disclosed": false
}
